{
  "$id": "EPfW52_f_WIMEA9Qhb1WQcPnMXiRe-1FnIFlxqEqp_Bj",
  "$schema": "https://json-schema.org/draft/2020-12/schema",
  "title": "SEDI Age-and-Portrait Presentation",
  "description": "A holder-issued SEDI presentation for the common 'prove over-21 and show the state-endorsed photo' verification pattern (e.g. venue/alcohol admittance, Utah Code 63A-20-204(2)(a)). Issuer = the holder (Discloser); issuee = the verifier (Disclosee). It combines the holder's two source credentials by reference via I2I edges -- the SEDI Core identity credential (for the state-endorsed portrait, disclosed by selective disclosure of just that block) and a sedi-age attestation (for the over-21 boolean) -- and binds the verifier to the SEDI governance framework referenced in 'r'. It is issued into the holder's presentation registry, which 'rd' names (this.i @lm37js6k), so its state is anchored and revocable by the holder. This is the first concrete verifier-pattern schema; a general presentation-base would be extracted once a second pattern exists (this.i @sdp3wk).",
  "$comment": "An ACDC v2 attribute+edges+rules field-map credential (ilk 'acm'). The schema ENFORCES the pattern's teeth: every edge operator is pinned to const 'I2I' (the same-holder binding), and the governance reference 'r' and the presentation registry 'rd' are required, so an unregistered or non-I2I presentation is rejected. Migrated to the v2 envelope by this.i @lkfnoess, so the I2I edges into SEDI Core and sedi-age no longer cross a protocol-version boundary; 'rd' became required under @lm37js6k.",
  "credentialType": "SEDI_AgePortraitPresentation",
  "version": "4.0.0",
  "type": "object",
  "required": [
    "v",
    "t",
    "d",
    "i",
    "rd",
    "s",
    "a",
    "e",
    "r"
  ],
  "properties": {
    "v": {
      "description": "ACDC version string",
      "type": "string"
    },
    "t": {
      "description": "Message type; 'acm' is the field-map ACDC ilk",
      "const": "acm"
    },
    "d": {
      "description": "SAID of the presentation",
      "type": "string"
    },
    "u": {
      "description": "Top-level blinding nonce; present => private variant",
      "type": "string"
    },
    "i": {
      "description": "Issuer = the holder (Discloser) AID",
      "type": "string"
    },
    "rd": {
      "description": "Registry SAID",
      "type": "string"
    },
    "s": {
      "description": "SAID of this schema",
      "type": "string"
    },
    "a": {
      "oneOf": [
        {
          "description": "SAID of the attribute block",
          "type": "string"
        },
        {
          "description": "Attribute block: the interaction facts",
          "type": "object",
          "required": [
            "d",
            "u",
            "i",
            "ageOver21"
          ],
          "properties": {
            "d": {
              "description": "SAID of the attribute block",
              "type": "string"
            },
            "u": {
              "description": "Attribute-block blinding nonce (salty)",
              "type": "string"
            },
            "i": {
              "description": "Issuee = the verifier (Disclosee) AID",
              "type": "string"
            },
            "ageOver21": {
              "description": "The holder's asserted over-21 summary; authoritatively backed by the 'age' I2I edge to a sedi-age credential",
              "type": "boolean"
            },
            "venue": {
              "description": "Where the presentation is made (free text)",
              "type": "string"
            },
            "occurredAt": {
              "description": "When the presentation is made",
              "type": "string",
              "format": "date-time"
            }
          },
          "additionalProperties": false
        }
      ]
    },
    "e": {
      "oneOf": [
        {
          "description": "SAID of the edge block",
          "type": "string"
        },
        {
          "description": "Edge block: I2I edges to the two source credentials",
          "type": "object",
          "required": [
            "d",
            "identity",
            "age"
          ],
          "properties": {
            "d": {
              "description": "SAID of the edge block",
              "type": "string"
            },
            "u": {
              "description": "Edge-block blinding nonce (salty)",
              "type": "string"
            },
            "identity": {
              "description": "I2I edge to the holder's SEDI Core identity",
              "oneOf": [
                {
                  "description": "SAID of the edge",
                  "type": "string"
                },
                {
                  "type": "object",
                  "required": [
                    "d",
                    "n",
                    "s",
                    "o"
                  ],
                  "properties": {
                    "d": {
                      "description": "SAID of this edge",
                      "type": "string"
                    },
                    "u": {
                      "description": "Edge blinding nonce (salty)",
                      "type": "string"
                    },
                    "n": {
                      "description": "SAID of the far node (the SEDI Core credential)",
                      "type": "string"
                    },
                    "s": {
                      "description": "SEDI Core schema SAID",
                      "const": "EN0JtdzBmFuTUzyJG9CXZhtdu-bW0V6L95bsVBzi-cY-"
                    },
                    "o": {
                      "description": "Edge operator: I2I asserts the issuer of this presentation is the issuee of the far node (same holder)",
                      "const": "I2I"
                    }
                  },
                  "additionalProperties": false
                }
              ]
            },
            "age": {
              "description": "I2I edge to the holder's sedi-age attestation",
              "oneOf": [
                {
                  "description": "SAID of the edge",
                  "type": "string"
                },
                {
                  "type": "object",
                  "required": [
                    "d",
                    "n",
                    "s",
                    "o"
                  ],
                  "properties": {
                    "d": {
                      "description": "SAID of this edge",
                      "type": "string"
                    },
                    "u": {
                      "description": "Edge blinding nonce (salty)",
                      "type": "string"
                    },
                    "n": {
                      "description": "SAID of the far node (the sedi-age credential)",
                      "type": "string"
                    },
                    "s": {
                      "description": "SEDI Age schema SAID",
                      "const": "EPqXrwPT6b0_KghrrMuIdmuD68Aytv1XK6jU86EumgJV"
                    },
                    "o": {
                      "description": "Edge operator: I2I asserts the issuer of this presentation is the issuee of the far node (same holder)",
                      "const": "I2I"
                    }
                  },
                  "additionalProperties": false
                }
              ]
            }
          },
          "additionalProperties": false
        }
      ]
    },
    "r": {
      "description": "SAID of the governing SEDI governance framework (sedi-id/rules.json); carries the chain-link-confidentiality and duty-of-loyalty terms the verifier accepts",
      "type": "string"
    }
  },
  "additionalProperties": false
}
