{
  "v": "ACDCCAACAAJSONAARB.",
  "t": "acm",
  "d": "ENhHgOtqCs50mOBpdQRcVtWErM8ZRlVXtmfNv6OA4qUf",
  "u": "0ABwcmVzdG9wbm9uY2UwcmF3",
  "i": "EDB8gKNwzurf33pV2hsyGR9XFOmitDhc0LUzDamcU2JR",
  "rd": "ELUW5D0X0pMFM30ZHZKB997lad86PISushrKkKzlhQrl",
  "s": "EPfW52_f_WIMEA9Qhb1WQcPnMXiRe-1FnIFlxqEqp_Bj",
  "a": {
    "d": "EHFNzPfy1OzHB-iomK992Gk_mLEOVwGADxA52luajPzO",
    "u": "0ABwcmVzYXR0cm5vbmNlMHJh",
    "i": "EJQON0fDA5FKC14BKbk921e212IctfjLsCL7l46OzHgG",
    "ageOver21": true,
    "venue": "The Alcove Club, 200 S West Temple, Salt Lake City UT",
    "occurredAt": "2026-07-14T21:30:00.000000+00:00"
  },
  "e": {
    "d": "EJD_hamnqvHPp9LtnUZ2KOBOj7G1IJPXM17DXg2HbOai",
    "u": "0ABwcmVzZWRnZW5vbmNlMHJh",
    "identity": {
      "d": "EEuba8dxONPv6vciQZCsq3QKt4zpDSBHIIixx4F-X8C2",
      "u": "0ABwcmVzaWRlZGdlbm9uY2Uw",
      "n": "EGsPyGCyHtDSWP61rVsRh3F8qooP_jrX6qPHqHn7-FOg",
      "s": "EN0JtdzBmFuTUzyJG9CXZhtdu-bW0V6L95bsVBzi-cY-",
      "o": "I2I"
    },
    "age": {
      "d": "EK8byBTVK9AxaAlu929Xj6tNk-2DuKxKsOjBlVUFGDzG",
      "u": "0ABwcmVzYWdlZWRnZW5vbmNl",
      "n": "ECfZCyLfleF3zA8qsHJ0WZYXW5xyR-aPDC8dl6RfLd27",
      "s": "EPqXrwPT6b0_KghrrMuIdmuD68Aytv1XK6jU86EumgJV",
      "o": "I2I"
    }
  },
  "r": "EG8X1nQFCrQ4Rg8BjfE0-BIuKSo1TVbwqymQ3Wuam6VW"
}
